{
  "schema_version": 1,
  "repo_id": "one-tool",
  "repo_label": "one-tool",
  "repo_root": "../../../../../one-tool",
  "cohort_manifest": "../signal-cohorts.json",
  "cohort_id": "agent-loop-core",
  "live_batch_manifest": "../batches/one-tool-codex-session-batch.json",
  "replay_batch_manifest": "../batches/one-tool-diff-replay-batch.json",
  "artifacts": {
    "seeded_defect_report": null,
    "remediation_report": null,
    "benchmark_artifact": "../../examples/one-tool-benchmark.json",
    "review_packet_output": ".sentrux/evals/one-tool/check-review-packet.md",
    "review_verdicts_input": "../../examples/one-tool-review-verdicts.json",
    "review_verdicts_output": ".sentrux/evals/one-tool/review-verdicts.json",
    "scorecard_output": ".sentrux/evals/one-tool/signal-scorecard.json",
    "backlog_output": ".sentrux/evals/one-tool/signal-backlog.json"
  },
  "batch_notes": "Checked-in calibration manifest for the mixed TypeScript and Python public repo configured by ONE_TOOL_ROOT. Use it for public onboarding/ranking evidence and broad mixed-language structural pressure, not for seeded-defect promotion."
}
